,title,title_label
0,이쯤되면 살만하지 않아카카오를 보는 시선이 달라지고 있다,1
1,네이버카카오 금융복합기업집단 지정해 리스크 대비해야,1
2,신한카드 공인전자문서 중계 서비스 부 능선카카오 등과 경쟁,0
3,네이버카카오 간밤 나스닥 반등에 동반 ,1
4,코스피  증시 훈풍에 상승네이버카카오 대 강세 개장시황,1
5,카카오 블랙아웃 방지법 국회 통과,1
6,플랫폼도 국가재난계획에 포함카카오 블랙아웃 방지법 국회 통과,1
7,카카오두나무위메이드 인연과 악연 사이,1
8,뼈 아팠던 서비스 장애 카카오 시스템 영역별 다중화 이어간다,0
9,카카오 모두를 위한  도전 이어간다,1
10,커리어데이 카카오구글 출신 황성현 경영고문 영입,0
11,샤넬 향수 사면 뷰티 클래스 초대장 카카오 기프트엑스 출시,0
12,카톡에서 선물하면 샤넬 뷰티 클래스에 초대카카오 기프트엑스,0
13,카카오 시스템 다중화로 먹통 막는다,0
14,카카오의 고백끊긴 다리와 같았다,1
15,카카오의 뼈아픈 고백완성되지 않은 다리로 섬 이었다,1
16,카카오 시스템 전체 다중화로 먹통 방지서비스 안정화가 최우선,0
17,반성의 장된 카카오 개발자 콘퍼런스 먹통 재발방지안 공개,0
18,시스템 다중화비상대응 체계 구축 먹통 재발 방지대책 내놓은 카카,0
19,카카오가 직접 다 밝혔다 카카오 대란의 원인은,1
20,중국이 퍼간 국내 웹툰웹소설 카카오엔터가 만건 잡아냈다,0
21,카카오엔터 개월간 불법 웹툰웹소설 만건 차단,0
22,영상 카카오 먹통사태 이중화 미흡 때문재발방지책 발표,0
23,본질 놓쳤다 반성문 쓴 카카오 년간 투자 배 확대종합,0
24,서울산업진흥원 네이버카카오에서  온라인 판로 개척,1
25,두 번 실수 없다 카카오 대표 직속  인프라 컨트롤타워 만든다,1
26,카카오 서비스 안정화 투자 배 늘린다전담 조직  직속으로,0
27,카카오 사태 사회적 책임소명 다할 것,1
28,영상카카오 오늘 먹통 사태 구체적 원인재발방지책 발표,0
29,카카오모빌리티 시그니처 향기 슬로우 그린 개발벤티에 적용,0
30,센트온 카카오모빌리티 시그니처 향기 개발,1
31,카카오 택시 전용 향기 나온다,0
32,카카오네이버 먹통 복구 시간 차이 원인은 이중화 조치 여부,0
33,과기정통부 카카오에 재발방지 요구한달 내 제출,1
34,카카오 장애복구 시간 걸렸다 제의 카카오 블랙아웃 해법은,0
35,디지털 재난대응   카카오 네이버개월 내 개선조,0
36,화재 원인 여전히 미궁 강제성 없는 행정지도 실효성 글쎄 제의 카,0
37,과기정통부 카카오 먹통 사태 개선계획 한달 내 보고하라,0
38,과기정통부 카카오 먹통 피해 만천건,0
39,판교 배터리 모니터링 작동안해카카오에도 다중화 지시,0
40,카카오 데이터센터 분산하라,0
41,시그널 로카모빌리티 본입찰맥쿼리카카오 파전 되나,0
42,디지털 재난대응 카카오 대기 시스템 제대로 작동하지 않아,0
43, 월드컵 강 진출에 네이버카카오도 특수,1
44,세계 최초 카카오가 해냈다공개 앞둔 새 먹거리 정체,0
45,먹통 달만에 재발방지책 발표하는 카카오,1
46,금감원 카카오금융사 재난 비상대응 미흡 포착,0
47,네이버카카오 커뮤니티 서비스에 목숨 건다인싸,0
48,연기금의 변심엔솔 팔고 이젠 네이버카카오 산다,0
49,카카오 먹통으로 금전적 피해봤다는 무료 이용자 만명,0
50,카카오 블랙아웃 피해 중 유료 서비스는 ,0
51,허리띠 졸라맨 네이버카카오 목표주가 개월 만에 올랐다,1
52,미들마일에 돈 몰린다카카오티맵도 뛰어든 조원 시장,0
53,네이버카카오 이젠 좀 살아날까 나스닥 훈풍에 강세,0
54,네이버카카오 나스닥 훈풍에  상승,1
55,특징주 나스닥 훈풍네이버 카카오  동반 강세,0
56,특징주 네이버카카오 대 강세  나스닥 훈풍 영향,0
57,특징주네이버카카오  나스닥 훈풍에 강세,0
58,카카오모빌리티 선한 영향력 발휘한 도로 위 히어로즈 찾는다,0
59,택시 인식 긍정적으로카카오모빌리티 도로 위 히어로즈 공모,0
60,증시에 파월 산타 오셨나나스닥  급등에 카뱅 카카오,0
61,비둘기로 돌변한 파월 의장카카오카뱅카페 주주들 환호성,0
62,특징주 네이버카카오 나스닥 급등에 장중 동반 강세,0
63,카카오 먹통 사태 보상 협의체 차 전체 회의 연다,0
64,특징주 네이버카카오 파월 속도조절 시사에 급등,0
65,나스닥 급등에 네이버카카오 강세카카오페이  개장시황,1
66,몸집만 카카오 당근마켓 수장교체 전략 먹힐까,0
67,카카오현대 기술 모았다무료 달구벌 자율주행차 어떻게 타요,0
68,네이버카카오토스쿠팡페이 내년부터 깜깜이 수수료 연 회 공시,0
69,네이버카카오 내년 월부터 간편결제 수수료율 공시한다,0
70,카카오네이버 내년부터 간편결제 수수료 공시 총 수수료 공개 ,0
71,네이버카카오 내년 월부터 간편결제수수료 공시한다,0
72, 나선 카카오엔터텐센트 본사 임원 이사회 진입,0
73,엔씨 팬덤 플랫폼 유니버스 카카오엔터에 매각 추진,0
74,카카오 먹통에도 이용자 증가한 콘텐츠모빌리티이유는,0
75,카카오 잡겠다는 플랫폼 규제커머스 업계 초토화시킬 것,0
76,월 카카오 먹통사태 방지방안 나온다,0
77,코스피 외인기관 동반 사자에 상승 마감카카오기아 강세,0
78,카카오 역량 결집한 달구벌자율차 대구 달린다,0
79,카카오메이커스의 상생 프로그램 제버가치 누적 거래액 억 돌파,1
80,카카오메이커스 농축수산물 판로 개척누적 거래액 억 돌파,1
81,카카오모빌리티 년생 사외이사 선임 속도 낼까,0
82,실적 하향 이어지는 네이버카카오신규매출비용절감 필요,1
83,년생 이사 파격 선임카카오모빌리티  속도 붙나,0
84,카카오 디지털 보안 업체 지분 사들인 까닭은,0
85,카카오 내달 일 장애원인 조사결과 발표,0
86,아 카카오 그룹주 동반 하락남몰래 웃는 카뱅,0
87,특징주 카카오그룹 약세국세청 카카오 계열사 특별 세무조사 영,0
88,특징주 카카오 계열사 세무조사 소식에 그룹주 약세,0
89,카카오 먹통 사태 그 후위기 막는 스타트업 안전 기술들 뜬다,0
90,국세청 카카오 계열사 특별 세무조사,0
91,국세청 카카오 계열사 특별 세무조사,0
92,국세청 카카오 계열사 특별 세무조사 착수탈세 여부 검증,0
93,카카오 와 중소사업자 대상 개인정보보호 교육,1
94,카카오 와 중소사업자 대상 개인정보보호 교육 맞손,0
95,카카오 중소사업자 개인정보보호 온라인 교육,1
96,카카오 먹통 방지책 맡은 남궁훈 치부 공개 부끄럽지만 성장 기회될 것,1
97,남궁훈 카카오 규모의 기업이 치부 공개 세계적으로도 드문 일,1
98,카뱅 출신 국회의원이 바라본 카카오 거버넌스는,0
99,금리인상 속도조절 기대감에빅테크 카카오네이버 강세,0
100,빈 살만이 관심 보이니네이버카카오 동반 강세,0
101,빈 살만 왕세자가 카카오 찜해투자검토 소식에 주가 급등,0
102,카카오 내달 먹통 사태 재발방지대책 발표,0
103,카카오 먹통 보상개선안 마련 속도 내지만 갈 길 멀어,0
104,카카오 내달 일 먹통 사태 재발방지대책 공개한다,0
105,카카오 다음달 일 대규모 장애 원인재발방지책 공개한다,0
106,빈살만 투자 기대감 카카오카겜 급등,0
107,카카오 서울카페쇼 온라인 페어 진행브랜드 지원 목적,0
108,땡큐 빈 살만사우디 코인 탑승 카카오 주주들 함박웃음 이종,0
109,특징주 빈 살만 카카오엔터 투자 논의에 모회사 카카오 대 강,0
110,특징주카카오 사우디 국부펀드 투자 보도에 대 강세,0
111,빈 살만이 찍었다카카오 그룹주 일제히 급등,0
112,빈 살만이 콕 찍은 돈 될만한 회사카카오 총사 동반 강세,0
113,특징주빈살만 투자 소식에카카오  등 그룹주 급등,0
114,빈살만 카카오엔터 투자 추진 기대대원미디어  급등,0
115,당근마켓 신임대표로 카카오 출신 황도연 부사장 내정,0
116,당근마켓 카카오 출신 황도연 신임 대표 내정김재현 대표는 로,1
117,코스피 개인 사자에 상승 출발카카오 강세 개장시황,1
118,사우디 국부펀드 카카오엔터에 억 투자 검토,0
119,빈살만의  카카오엔터에 억 투자 검토,0
120,단독 빈살만의 사우디국부펀드 카카오엔터에 투자 추진,0
121,카카오 먹통사태 보상논의 첫발 피해사례만 만건,0
122,먹통 사태 보상회의 첫발카카오 보상까지 먼산,0
123,카카오 홍은택 피해 지원 카카오 혼자 풀기 어렵다,0
124,먹통 사태 보상책 논의 카카오  피해지원 협의체 첫 회의,0
125,카카오 먹통 사태 피해 보상 협의체 첫 회의,0
126,웹툰 거래액 줄은 카카오외형보다 내실,0
127,카카오 품에 안긴 타파스엔터 웹툰  서 선전,0
128,카카오엔터 타파스 뉴욕 애니메이션 행사 참가팬 여명 몰려,0
129,카카오 피해지원 협의체 회의소상공인연합회 관계자 등 참여,0
130,카카오 장애 보상안 마련할 협의체 첫 회의 열어,0
131,키위플러스 카카오키즈폰 등 높은 매출 성장세 지속월 누적 매출 ,1
132,카카오 먹통 판교 데이터센터 찾아 보상규모 손해사정 착수,0
133,카카오 먹통 보상규모 얼마나 될까손해사정 착수,0
134,여보 천 손실 감수하고 팔자 좀 더 버티자 골칫거리 된 카카,0
135,국민주 카카오 떠나는 동학개미,1
136,유안타 주간추천주삼성전자크래프톤카카오,0
137,카카오 소상공인 대상 상생 기획전 연다,1
138,제의 카카오 사태 막는다국민은행 넷퍼넬 도입,0
139,카타르 월드컵 오픈채팅에서 함께 응원하자카카오,1
140,카카오엔터프라이즈 파트너사와 마켓플레이스 프로모션 진행,0
141,카카오 문어발식 확장 촘촘히 막는다 기업결합 신고기준 정비,1
142,카카오 경쟁사 아이돌 비방 의혹공정위 또 조사,0
143,카카오 먹통 방지법 통과에 주목받는 데이터 관련주,1
144,마켓워치베이스매쉬업카카오 웰니스 큐레이션 가,0
145,카카오 먹통 어떻게 보상받나협의체 구성했지만 갈 길 멀다,0
146,카카오스타일 패션바이카카오 입점 스토어 곳 돌파,1
147,카카오스타일 패션바이카카오 입점 스토어 곳 돌파,1
148,빈 살만이 관심 보이니네이버카카오 동반 강세,0
149,빈 살만 왕세자가 카카오 찜해투자검토 소식에 주가 급등,0
150,카카오 내달 먹통 사태 재발방지대책 발표,0
151,카카오 먹통 보상개선안 마련 속도 내지만 갈 길 멀어,0
152,카카오 내달 일 먹통 사태 재발방지대책 공개한다,0
153,카카오 다음달 일 대규모 장애 원인재발방지책 공개한다,0
154,빈살만 투자 기대감 카카오카겜 급등,0
155,카카오 서울카페쇼 온라인 페어 진행브랜드 지원 목적,0
156,땡큐 빈 살만사우디 코인 탑승 카카오 주주들 함박웃음 이종,0
157,특징주 빈 살만 카카오엔터 투자 논의에 모회사 카카오 대 강,0
158,특징주카카오 사우디 국부펀드 투자 보도에 대 강세,0
159,빈 살만이 찍었다카카오 그룹주 일제히 급등,0
160,빈 살만이 콕 찍은 돈 될만한 회사카카오 총사 동반 강세,0
161,특징주빈살만 투자 소식에카카오  등 그룹주 급등,0
162,빈살만 카카오엔터 투자 추진 기대대원미디어  급등,0
163,당근마켓 신임대표로 카카오 출신 황도연 부사장 내정,0
164,당근마켓 카카오 출신 황도연 신임 대표 내정김재현 대표는 로,1
165,코스피 개인 사자에 상승 출발카카오 강세 개장시황,1
166,빈살만 카카오엔터 투자 추진 기대대원미디어  급등,0
167,빈 살만이 콕 찍은 돈 될만한 회사카카오 총사 동반 강세,0
168,특징주빈살만 투자 소식에카카오  등 그룹주 급등,0
169,당근마켓 신임대표로 카카오 출신 황도연 부사장 내정,0
170,당근마켓 카카오 출신 황도연 신임 대표 내정김재현 대표는 로,1
171,코스피 개인 사자에 상승 출발카카오 강세 개장시황,1
172,특징주 빈 살만 카카오엔터 투자 논의에 모회사 카카오 대 강세,0
173,특징주카카오 사우디 국부펀드 투자 보도에 대 강세,0
174,사우디 국부펀드 카카오엔터에 억 투자 검토,0
175,빈살만의  카카오엔터에 억 투자 검토,0
176,단독 빈살만의 사우디국부펀드 카카오엔터에 투자 추진,0
177,카카오 먹통사태 보상논의 첫발 피해사례만 만건,0
178,먹통 사태 보상회의 첫발카카오 보상까지 먼산,0
179,카카오 홍은택 피해 지원 카카오 혼자 풀기 어렵다,0
180,먹통 사태 보상책 논의 카카오  피해지원 협의체 첫 회의,0
181,카카오 먹통 사태 피해 보상 협의체 첫 회의,0
182,웹툰 거래액 줄은 카카오외형보다 내실,0
183,카카오 품에 안긴 타파스엔터 웹툰  서 선전,0
184,카카오엔터 타파스 뉴욕 애니메이션 행사 참가팬 여명 몰려,0
185,카카오 피해지원 협의체 회의소상공인연합회 관계자 등 참여,0
186,카카오 먹통사태 보상논의 첫발 피해사례만 만건,0
187,먹통 사태 보상회의 첫발카카오 보상까지 먼산,0
188,카카오 홍은택 피해 지원 카카오 혼자 풀기 어렵다,0
189,먹통 사태 보상책 논의 카카오  피해지원 협의체 첫 회의,0
190,카카오 먹통 사태 피해 보상 협의체 첫 회의,0
191,웹툰 거래액 줄은 카카오외형보다 내실,0
192,단독 빈살만의 사우디국부펀드 카카오엔터에 투자 추진,0
193,카카오 품에 안긴 타파스엔터 웹툰  서 선전,0
194,카카오엔터 타파스 뉴욕 애니메이션 행사 참가팬 여명 몰려,0
195,카카오 피해지원 협의체 회의소상공인연합회 관계자 등 참여,0
196,카카오 장애 보상안 마련할 협의체 첫 회의 열어,0
197,키위플러스 카카오키즈폰 등 높은 매출 성장세 지속월 누적 매출 ,1
198,카카오 먹통 판교 데이터센터 찾아 보상규모 손해사정 착수,0
199,카카오 먹통 보상규모 얼마나 될까손해사정 착수,0
200,여보 천 손실 감수하고 팔자 좀 더 버티자 골칫거리 된 카카,0
201,국민주 카카오 떠나는 동학개미,1
202,카카오 장애 보상안 마련할 협의체 첫 회의 열어,0
203,키위플러스 카카오키즈폰 등 높은 매출 성장세 지속월 누적 매출 ,1
204,카카오 먹통 판교 데이터센터 찾아 보상규모 손해사정 착수,0
205,카카오 먹통 보상규모 얼마나 될까손해사정 착수,0
206,여보 천 손실 감수하고 팔자 좀 더 버티자 골칫거리 된 카카,0
207,국민주 카카오 떠나는 동학개미,1
208,유안타 주간추천주삼성전자크래프톤카카오,0
209,카카오 소상공인 대상 상생 기획전 연다,1
210,제의 카카오 사태 막는다국민은행 넷퍼넬 도입,0
211,카타르 월드컵 오픈채팅에서 함께 응원하자카카오,1
212,카카오엔터프라이즈 파트너사와 마켓플레이스 프로모션 진행,0
213,카카오엔터프라이즈 파트너사와 마켓플레이스 프로모션 진행,0
214,카카오 문어발식 확장 촘촘히 막는다 기업결합 신고기준 정비,1
215,카카오 경쟁사 아이돌 비방 의혹공정위 또 조사,0
216,카카오 먹통 방지법 통과에 주목받는 데이터 관련주,1
217,마켓워치베이스매쉬업카카오 웰니스 큐레이션 가,0
218,카카오 먹통 어떻게 보상받나협의체 구성했지만 갈 길 멀다,0
219,카카오스타일 패션바이카카오 입점 스토어 곳 돌파,1
220,카카오스타일 패션바이카카오 입점 스토어 곳 돌파,1
221,날뛰는 카카오 브러더스 헷갈리는 시장,0
222,공정위 금산분리 위반콜 몰아주기 등 카카오 사건 연내 결론종합,0
223,공정위 카카오 정조준금산분리 위반 제재 연내 결정,0
224,압박나선 공정위카카오 연내 제재 결정,0
225,한기정 카카오 금산분리 위반 여부 연내 결론,0
226,공정위 금산분리콜 몰아주기 등 카카오 관련 사건 연내 결론,1
227,카카오 협의체 구성해 서비스 장애 보상 논의외부 전문가 참여,1
228,카카오 협의체 구성해 서비스 장애 보상 논의외부 전문가 참여,1
229,공정위 카카오 정조준금산분리 위반 제재 연내 결정,0
230,압박나선 공정위카카오 연내 제재 결정,0
231,한기정 카카오 금산분리 위반 여부 연내 결론,0
232,공정위 금산분리콜 몰아주기 등 카카오 관련 사건 연내 결론,1
233,카카오 먹통사태 피해지원 협의체 구성,0
234,카카오 장애 보상안 마련위한  피해지원 협의체 발족,0
235,카카오 서비스 장애 관련  피해 지원 협의체 구성,0
236,카카오 서비스 먹통 사태 관련  피해지원 협의체 구성,0
237,도 년 걸렸다보상 시작한 카카오 산 넘어 산,0
238,공정위 카카오 김범수의 케이큐브 금산분리 위반 제재 임박,0
239,플랫폼 공정경쟁 제과제로한기정 공정위원장 네이버카카오 독,0
240,공정위원장 카카오 겨냥 독점플랫폼 사회적 책임 소홀,0
241,한기정 독점 플랫폼 사회적 책임 소홀카카오 등 독과점 남용 철퇴,1
242,종목속으로 블랙록 카카오  팔았는데,0
243,우티타다 카카오 독주 못 막았다,0
244,버티던 제왕 이수만 물러났는데카카오  인수 없던일로 무,0
245,카카오 피해 보상 년 걸릴 듯산 넘어 산,0
246,공정위원장 카카오 겨냥 독점플랫폼 사회적 책임 소홀,0
247,플랫폼 공정경쟁 제과제로한기정 공정위원장 네이버카카오 ,0
248,한기정 독점 플랫폼 사회적 책임 소홀카카오 등 독과점 남용 철퇴,1
249,도 년 걸렸다보상 시작한 카카오 산 넘어 산,0
250,종목속으로 블랙록 카카오  팔았는데,0
251,우티타다 카카오 독주 못 막았다,0
252,버티던 제왕 이수만 물러났는데카카오  인수 없던일로 무,0
253,카카오 피해 보상 년 걸릴 듯산 넘어 산,0
254,수억 손실 신불 위기 버텼는데카카오 이젠 오르나 선데이 머니,0
255,유안타 주간추천주삼성전자삼성엔지니어링카카오,0
256,외국인기관 조 쌍끌이 매수카카오 형제 두자릿수 날았다,0
257,외국인기관 조 쌍끌이 매수카카오 형제 두자릿수 날았다,0
258,스타트업 가 카카오 사태 원인조사 맡았다,0
259,카카오 먹통 사태 원인조사 소위원장에 이확영 그렙 ,0
260,카카오 초기 멤버 이확영 그렙 대표 카톡 대란 조사,0
261,단독 이확영 그렙 대표 카카오 서비스 먹통 조사 맡는다,0
262,광주에 카카오모빌리티 고객센터 들어선다,0
263,코스피 마감대 날아올라 선카카오 급등,0
264,코스피 대 올라 선카카오 삼전 대,1
265,나스닥 버프 받고 카카오 삼형제 급등카페는 장중 상한가 이종화의,1
266,코스피 대 상승세 이어져카카오 네이버  쑥쑥,1
267,인플레 정점 기대감에 코스피 안도랠리네이버 카카오  ,1
268,카카오메이커스 카카오프렌즈 기부 배지 제작한다,1
269,특징주카카오그룹 일제히 급등카카오  대 ,0
270,특징주 네이버카카오 나스닥 훈풍 타고 나란히 강세,0
271,인플레 정점 기대감에 코스피 안도랠리네이버 카카오  ,1
272,카카오메이커스 카카오프렌즈 기부 배지 제작한다,1
273,특징주카카오그룹 일제히 급등카카오  대 ,0
274,특징주 네이버카카오 나스닥 훈풍 타고 나란히 강세,0
275,네이버카카오 장 초반 대 급등금리인상 완화 기대감 증시이슈,0
276,특징주 급등 나스닥 훈풍에 네이버카카오 일제히 강세,0
277,특징주 나스닥 훈풍에 네이버카카오도 대 급등,0
278, 훈풍에 코스피 상승 출발카카오 대 개장시황,1
279,특징주 카카오 형제 나란히 웃음꽃카카오페이 ,0
280,시그널 카카오 조 두나무 주식 자회사 이관,1
281,카카오 삼총사 반등했지만매출성장 지켜봐야 경계 눈초리,1
282,빅데이터로 본 재테크 카카오 삼총사 반등했지만 매출성장 지켜봐,1
283,카카오 삼총사 반등했지만매출성장 지켜봐야 경계 눈초리,1
284,빅데이터로 본 재테크 카카오 삼총사 반등했지만 매출성장 지켜봐,1
285,현대차기아 자율주행 카카오 택시 강남 달린다,1
286,부르면 달려간다 현대차 무인 카카오 택시 강남 한복판서 실증실험,0
287,현대차기아 카카오로 자율주행차 부른다,0
288,카카오 카카오인베스트먼트에 조억원 주식 현물출자,1
289,카카오로 강남서 자율주행 택시 부른다,1
290,강남서 자율주행 택시 달린다카카오모빌리티현대차 시범서비스 시작,1
291,두 모빌리티 거인 협력카카오모빌현대차 강남서 자율주행 서비스 선,1
292,카카오모빌리티 자율주행 택시 복잡한 강남 도심 누빈다,1
293,사진 레벨 자율차 로보라이드 카카오로 호출,0
294,자율주행차 로보라이드 카카오로 부른다,0
295,현대차기아 카카오모빌리티와 로보라이드 시범 서비스 확대,0
296,현대차기아 카카오모빌리티와 강남 로보라이드 시범 서비스 확대,0
297,카카오엔터   인수 불발그룹 지배구조개편 제자리,0
298,카카오모빌리티 자회사 솔루션 임시 택시운전 자격 장관 표창,1
299,카카오 먹통 피해 외식업이 가장 컸다,0
300,소공연 카카오 먹통 피해 건 접수실질적 보상안 마련해야,0
301,카카오 소공연 등 여러 단체와 협의체 구성 논의,1
302,카카오 마비사태 피해 소상공인들 손해배상 협의체 구성하라,0
303,카카오 화재피해 외식업 가장 많았다,0
304,카카오 사태 막는다 비수도권 데이터센터에 전기요금 인센티브,0
305,두 모빌리티 거인 협력카카오모빌현대차 강남서 자율주행 서비스 선보,1
306,카카오모빌리티 자율주행 택시 복잡한 강남 도심 누빈다,1
307,현대차기아 카카오모빌리티와 강남 로보라이드 시범 서비스 확대,0
308,현대차기아 카카오모빌리티와 로보라이드 시범 서비스 확대,0
309,카카오엔터   인수 불발그룹 지배구조개편 제자리,0
310,카카오모빌리티 자회사 솔루션 임시 택시운전 자격 장관 표창,1
311,카카오 먹통 피해 외식업이 가장 컸다,0
312,소공연 카카오 먹통 피해 건 접수실질적 보상안 마련해야,0
313,카카오 소공연 등 여러 단체와 협의체 구성 논의,1
314,카카오 마비사태 피해 소상공인들 손해배상 협의체 구성하라,0
315,카카오 화재피해 외식업 가장 많았다,0
316,카카오 사태 막는다 비수도권 데이터센터에 전기요금 인센티브,0
317,카카오 전국 개 전통시장서 우리동네 단골시장 프로젝트,1
318,카카오 오는 일 우리동네 단골시장 프로젝트 시작,0
319,특징주 네이버카카오 이틀 연속 강세증권가 일시적 반등에 무게,0
320,단독 카카오맵 지하철 대란 상황 실시간 반영했는데네이버는 왜,1
321,카카오 전국 개 전통시장서 우리동네 단골시장 프로젝트,1
322,카카오 오는 일 우리동네 단골시장 프로젝트 시작,0
323,카카오 마비사태 피해 소상공인들 손해배상 협의체 구성하라,0
324,카카오 화재피해 외식업 가장 많았다,0
325,특징주 네이버카카오 이틀 연속 강세증권가 일시적 반등에 무게,0
326,단독 카카오맵 지하철 대란 상황 실시간 반영했는데네이버는 왜,1
327,카카오 사건으로 본위기관리 ,0
328,코스피 선 터치다운네이버카카오 모처럼 불상승,1
329,그룹 석달새 계열사 개 늘려카카오 개사 흡수매각,0
330, 계열사 개 증가카카오는 개 줄여,0
331,카카오 먹통사태   데이터센터 이번엔 감전사고 명 부상,0
332,카카오모빌리티 신입경력 개발자 공채두 자릿수 채용 목표,0
333,카카오모빌리티 신입경력 개발자 공채일까지 접수,0
334,카카오모빌리티 첫 단독 공채두 자릿수 뽑는다,1
335,교통약자 지원카카오맵 서울 지하철역 승강장 간격높이 정보 제공,1
336, 열차승강장 거리 넓어요카카오맵 교통약자 정보 강화,1
337,카카오맵 서울 지하철역 승강장 간격높이 정보 제공,1
338, 계열사 개 증가카카오는 개 줄여,0
