,title,title_label
2351,자사주 판 네이버 임원 사들인 카카오,0
2352,카카오 지분 매각 후 대주주 전환 시나리오 공개카카오모빌리티 매각 ,0
2353,이제 볕드나 했더니 주르륵카카오 반등장 속 나홀로 급락,0
2354,이제 다음 아이디로 로그인 안됩니다월 카카오로 통폐합,0
2355,카카오내비 기록만큼 돈내는 운전자보험 판다 당 원,0
2356,운전 안 하면 원 카카오모빌리티 주행한 만큼 내는 운전자보험 ,0
2357,안 탈 땐 꺼두세요카카오모빌리티 운전한 만큼 내는 보험 선보여,0
2358,구글카카오 인앱결제 갈등 실마리는,0
2359,영상방통위 카카오구글 자대면결제문제 해결 노력,0
2360,네이버카카오쿠팡 만난 총리데이터 법 개선안 신속히 마련,1
2361,자사주 판 네이버 임원 사들인 카카오,0
2362,카카오네이버 만난 한 총리 데이터 규제 개선모든 과제 시급,1
2363,카카오 서울 일러스트레이션 페어 참가이모티콘 창작자 응원,1
2364,클릭 종목카카오 분기는 부진하나 하반기 마진개선 기대,0
2365,아이브가 가요계 휩쓸자카카오엔터가 웃는다 왜,0
2366,카카오 서울 일러스트레이션 페어 참가이모티콘 창작자 응원,1
2367,안 탈 땐 꺼두세요카카오모빌리티 운전한 만큼 내는 보험 선보여,0
2368,클릭 종목카카오 분기는 부진하나 하반기 마진개선 기대,0
2369,아이브가 가요계 휩쓸자카카오엔터가 웃는다 왜,0
2370, 카카오모빌리티 지분 +주 조에 인수 시그널,0
2371,다 올랐네 카카오만 빼고카카오모빌리티 매각 추진에 약세,0
2372,카카오 카카오모빌리티 지분 대 매각 검토 중,0
2373,카카오 카카오모빌리티 지분 대 매각 검토 중,0
2374,카카오 카카오모빌리티 지분 대 매각 검토 중주목 공시,1
2375,카카오 카카오모빌리티 지분 대 매각 검토 중,0
2376,방통위 가운데 두고 얼굴 맞댄 카카오구글인앱결제 실마리 찾을까,0
2377,인앱결제 갈등 조율하나방통위 구글카카오 만난다,0
2378,네이버카카오 작년 보안 투자 투자액의 삼성은 ,0
2379,단독 헤어샵 투자자들 뿔났다카카오에 일내 간담회 요청,0
2380,시그널 외우내환 휩싸인 카카오 빅딜팀 원년 멤버 재영입,1
2381,국내 최초 의료데이터 청산카카오헬스케어 힘준다,1
2382,카카오 카카오모빌리티 지분 대 매각 검토 중,0
2383,카카오 카카오모빌리티 지분 대 매각 검토 중,0
2384,카카오 카카오모빌리티 지분 대 매각 검토 중주목 공시,1
2385,카카오 카카오모빌리티 지분 대 매각 검토 중,0
2386,시그널 외우내환 휩싸인 카카오 빅딜팀 원년 멤버 재영입,1
2387,국내 최초 의료데이터 청산카카오헬스케어 힘준다,1
2388,기름값이 폭락했다   급락하자카카오 주식 웃었,1
2389,단독아웃링크 둘러싼 구글카카오 기싸움 공정위로 공 넘어간다,0
2390,카카오 모빌리티 지분  매각 검토 공지대 주주 되나,0
2391,카카오  모빌리티 매각 반대에 대 팔아 대주주 변경 검토,0
2392,카카오 모빌리티 지분 대 매각 검토 대주주로 남겠다,0
2393,카카오구글 인앱결제 대치 국면에방통위 자대면 자리 만든다,0
2394,카카오 규제이미지 때문에 모빌리티 매각 불가피노조 팔면 성장하,0
2395,카카오모빌리티 매각 반대 운동 재개다시 불붙은 노사 갈등,1
2396,모빌리티와 경영방향 맞지 않다매각으로 기우는 카카오,0
2397,카카오노조 모빌리티 매각 반대 서명운동 재개사측은 매각 의지 확,1
2398,단독 카카오 베팅 코인투자사 루나로 억 날렸다,0
2399,다우키움그룹 금융당국 감독받는다카카오는 내년 유력,0
2400,카카오구글 인앱결제 대치 국면에방통위 자대면 자리 만든다,0
2401,카카오 규제이미지 때문에 모빌리티 매각 불가피노조 팔면 성장하,0
2402,카카오모빌리티 매각 반대 운동 재개다시 불붙은 노사 갈등,1
2403,모빌리티와 경영방향 맞지 않다매각으로 기우는 카카오,0
2404,카카오노조 모빌리티 매각 반대 서명운동 재개사측은 매각 의지 확,1
2405,단독 카카오 베팅 코인투자사 루나로 억 날렸다,0
2406,카카오 모빌리티 지분 대 매각 검토 대주주로 남겠다,0
2407,다우키움그룹 금융당국 감독받는다카카오는 내년 유력,0
2408,카카오 형제 볕드나카카오카뱅카페 사흘째 상승 마감,1
2409,카카오엔터 첫 회사채 발행년 만기 억원 규모,1
2410,카카오메이커스 제가버치 프로젝트 입점 파트너 모집,1
2411,카카오가 농민어민 제값 주고 홍보까지 돕는다,0
2412,카카오메이커스 농축산물 판로 여는 제가버치 파트너 모집,1
2413,핀덴 일 카카오 쇼핑 라이브 론칭,0
2414,특징주 카카오 장 초반 대 강세네이버 하루 만에 반락,0
2415,카카오메이커스 제가버치 프로젝트 입점 파트너 모집,1
2416,카카오가 농민어민 제값 주고 홍보까지 돕는다,0
2417,카카오메이커스 농축산물 판로 여는 제가버치 파트너 모집,1
2418,핀덴 일 카카오 쇼핑 라이브 론칭,0
2419,특징주 카카오 장 초반 대 강세네이버 하루 만에 반락,0
2420,인앱결제 반기 든 카카오 카톡 업데이트 불가 칼 뺀 구글,0
2421,인앱결제 두고 카카오구글 마이웨이소비자는 난감,0
2422,인앱결제 거부 카카오에 나가라는 구글 플랫폼간 갈등 고조,0
2423,현대백 초대형 화면서 카카오엔터 팝 나온다,1
2424,현대백화점면세점 카카오엔터테인먼트와 컬쳐 콘텐츠 제휴,1
2425,매각 불씨 살아있는데카카오 이름 쓰고픈  안된다는 카카오,0
2426,단순하지 않다카카오모빌리티 매각설 둘러싼 경우의 수,0
2427,단독 카카오 지분플랫폼 남기고모빌리티 매각,0
2428,웹소설이 웹툰게임으로 무한확장 네이버카카오 슈퍼 시대 ,1
2429,카카오엔터 억뷰 슈퍼  나혼렙 일본 유명 제작사와 애니메,0
2430,카카오엔터 나혼렙  유명 제작사 손잡고 애니메이션화,1
2431,매각 불씨 살아있는데카카오 이름 쓰고픈  안된다는 카카오,0
2432,단순하지 않다카카오모빌리티 매각설 둘러싼 경우의 수,0
2433,단독 카카오 지분플랫폼 남기고모빌리티 매각,0
2434,웹소설이 웹툰게임으로 무한확장 네이버카카오 슈퍼 시대 ,1
2435,카카오엔터 억뷰 슈퍼  나혼렙 일본 유명 제작사와 애니메,0
2436,카카오엔터 나혼렙  유명 제작사 손잡고 애니메이션화,1
2437,네이버카카오 직원들 부럽네오늘부터 전면 재택근무,0
2438, 카카오 클래스 심화 과정 참가자 모집,0
2439,카카오 소상공인에 톡스토어 활용 노하우 푼다,0
2440,카카오 소상공인 대상 카카오클래스 심화과정 모집톡스토어 활용법,0
2441,카카오  카카오 클래스 심화과정 참가자 모집,0
2442,네이버카카오 일부터 상시 원격근무 돌입,0
2443,네이버 주간일기 챌린지 성공에 카카오도 일상기록 서비스 반격,0
2444,협회 가입한 카카오 손보베타적사용권 협약 신청 수순 밟을 듯,0
2445,동학개미 악몽상반기 코스피  급락 삼전 카카오 신저가,0
2446,카카오  카카오 클래스 심화과정 참가자 모집,0
2447,네이버카카오 일부터 상시 원격근무 돌입,0
2448,네이버 주간일기 챌린지 성공에 카카오도 일상기록 서비스 반격,0
2449,협회 가입한 카카오 손보베타적사용권 협약 신청 수순 밟을 듯,0
2450,동학개미 악몽상반기 코스피  급락 삼전 카카오 신저가,0
2451,수억원짜리 카톡 프로필 탄생할까 인스타페북 이어 카카오도 이 기,0
2452,카카오 코인원 실명계좌 제휴 임박 가상자산 시장 영향력 커진다,0
2453,브랜드가치 성장률 위는 카카오 순위는 네이버텔레콤카카오 ,0
2454,삼성전자네이버카카오 더 빠진다 지금은 여기에 주목할 때,1
2455,국민주서 근심주로 전락한 카카오주가 회복 가능할까,0
2456,카카오엔터프라이즈 서비스형 인프라로  통과,0
2457,카카오손보 협회 회원 가입 완료유일 디지털손보 정회원사 등록,1
2458,모빌리티 매각설 진통 카카오  컨트롤타워 역할 커졌다,1
2459,모빌리티 매각설 후 어깨 무거워진 카카오 컨트롤타워 역할 증명,1
2460, 정확도 높아질 것티맵카카오모빌리티도 주목,1
2461,안전보건공단 카카오와 대리기사 건강진단 지원,0
2462,카카오모빌리티 대리운전 기사 대상 건강검진 무상 지원,0
2463,카카오모빌리티 대리기사 건강검진 및 상담 무상 지원일템,0
2464,카카오모빌리티 매각설 두고 노조와 소통 나선 카카오,0
2465,모빌리티 매각 논란에카카오 노사 긴급 회동,0
2466,카카오 경영진노조 긴급회동모빌리티 매각설 새 국면,0
2467,대학생이 가장 일하고 싶은 기업은카카오 년 연속 위,1
2468,매각설 나오는 카카오모빌리티에 무슨 일이,0
2469,카카오 노조 카카오모빌리티 매각 반대김범수 센터장 직접 나서라,0
2470,카카오  플랜 이상 신호잇따른 리스크 어쩌나,0
2471,카카오셀트리온생건위기 속 더 돋보이는 의 힘,1
2472,카카오 경영진노조 긴급회동모빌리티 매각설 새 국면,0
2473,대학생이 가장 일하고 싶은 기업은카카오 년 연속 위,1
2474,매각설 나오는 카카오모빌리티에 무슨 일이,0
2475,카카오 노조 카카오모빌리티 매각 반대김범수 센터장 직접 나서라,0
2476,카카오  플랜 이상 신호잇따른 리스크 어쩌나,0
2477,카카오셀트리온생건위기 속 더 돋보이는 의 힘,1
2478,프런티어 카카오 한국어 이해력 최고찰떡같이 알아듣죠,1
2479,카카오웹툰 야구 웹툰 기프트 드라마 제작 확정,0
2480,카카오 골프게임 멤버십 로 나온다,0
2481,삼성전자 카카오 주식 바닥모를 추락에 커진 적정주가 괴리,0
2482,네이버카카오 성장성에 베팅 우량채로 리스크 관리까지 이런 펀드 어,0
2483,싸이월드는 사망한 회원 사진 유족 준다는데네이버카카오는,0
2484,네이버카카오 성장성에 베팅 우량채로 리스크 관리까지 이런 펀드 어,0
2485,싸이월드는 사망한 회원 사진 유족 준다는데네이버카카오는,0
2486,같은 카카오인데 새 근무제 놓고 계열사 방글 본사 부글 왜 ,0
2487,먹튀그룹 오명 남기지 말라카카오 노조 뿔난 이유 배성수의 다,0
2488,개미 금기어 된 삼전카카오반려주식 죽기 전엔 팔 수 있을까,1
2489,카카오 노조 모빌리티 매각 반대김범수 면담 요청,0
2490,김범수 나와라 카카오 노조 모빌리티 매각 반대 단체행동 본격화,0
2491,단단히 뿔난 카카오노조카카오모빌리티 매각 반대 서명운동 나선다,0
2492,김범수 대주주가 나서라카카오노조 모빌리티 매각 면담요청,1
2493,카카오도  증시 모처럼 웃었다급반등 분위기 언제까지,0
2494,카카오 시총 위 탈환네이버와 나란히 대 반가운 상승,1
2495, 카카오와 전통시장 소상공인 디지털 교육 지원,0
2496, 카카오카카오임팩트신영시장 상인회와 함께 소신상인 프로,0
2497,네이버  카카오 페이 전쟁 승자는 누구,0
2498,김범수 대주주가 나서라카카오노조 모빌리티 매각 면담요청,1
2499, 카카오와 전통시장 소상공인 디지털 교육 지원,0
2500, 카카오카카오임팩트신영시장 상인회와 함께 소신상인 프로,0
2501,네이버  카카오 페이 전쟁 승자는 누구,0
2502,카카오 장중 만원선 회복 코스피 시총 위 탈환 증시이슈,0
2503,반발 매수에 상승 삼성전자네이버카카오  개장시황,0
2504,마이샵 카카오  골프연습장 창업 방송에 상담신청 급증,0
2505,   만전자 반토막카카오추락하는 국,0
2506,개월만에 구독자 네이버식 구독 서비스 카카오 빈틈 잘 노,1
2507,바사 카카오 증시 충격파 에 집중,0
2508,카카오엔터 얼굴인식기술 대회 키오스크부문 위,0
2509,스윽 스쳐가도 얼굴인식카카오 글로벌 위 올랐다,0
2510,얼굴만 스윽 해도카카오엔터프라이즈  얼굴 인식 기술 대회서,0
2511,카카오엔터 얼굴인식기술 대회 키오스크부문 위,0
2512,스윽 스쳐가도 얼굴인식카카오 글로벌 위 올랐다,0
2513,얼굴만 스윽 해도카카오엔터프라이즈  얼굴 인식 기술 대회서,0
2514,전자 카카오모빌리티와 손잡고 로봇 배송 시동,0
2515,신저가 행진에 올해 시총 조 증발한 카카오 형제개미들 피눈물,1
2516,영상규제보다 자율네이버카카오 혁신 역량 커지나,0
2517,카카오 년 만에 시총 위권 밖으로,1
2518,국민주 네이버카카오의 날개없는 추락,0
2519,트위터 후원도 카카오로카카오페이 송금 서비스 열었다,0
2520,전자 카카오모빌리티와 자율주행기술 협력,1
2521,전자 카카오모빌리티와 자율주행 로봇 배송 사업 맞손,0
2522,전자 카카오모빌리티와 새로운 모빌리티 기술서비스 발굴 나선다,1
2523,특징주카카오 시가총액 위권 밖으로기아와 역전,1
2524,카톡으로 단골 확보카카오 전통시장 디지털 전환 돕는다,0
2525,양천구 신영시장 디지털 전환 돕는 카카오,0
2526,카카오 소상공인상생 신설전통시장에 튜터 파견한다,1
2527,상생 공언한 카카오 소상공인 온라인 판매 과외 나선다,0
2528,특징주카카오 시가총액 위권 밖으로기아와 역전,1
2529,카톡으로 단골 확보카카오 전통시장 디지털 전환 돕는다,0
2530,양천구 신영시장 디지털 전환 돕는 카카오,0
2531,카카오 소상공인상생 신설전통시장에 튜터 파견한다,1
2532,상생 공언한 카카오 소상공인 온라인 판매 과외 나선다,0
2533,네이버카카오 간편결제 위 경쟁 치열 덩치가 곧 경쟁력,0
2534,브랜드발전소카카오모빌리티 광고 동맹 체결옥외광고 등 매체 시,0
2535,천원 가려면 천년원원 카카오 클레이에 투자자,0
2536,카카오 모빌리티 차별화 나선다,0
2537,전자 카카오모빌리티와 로봇배송 협력,1
2538,전자카카오모빌리티 미래차 연구개발 맞손,0
2539,전자 카카오모빌리티와 협력기술서비스 공동개발 나선다,0
2540,카카오모빌리티 매각 질문에 남궁훈 죄송합니다,0
2541,제회 퓨처포럼 글로벌 천만 크리에이터 시대 개막카,0
2542,카카오모빌리티전자 모빌리티 동맹기술생태계 혁신한다,0
2543,전자 카카오모빌리티와 자율주행 로봇 배송 사업 맞손,0
2544,전자 카카오모빌리티와 새로운 모빌리티 기술서비스 발굴 나선다,1
2545,전자 카카오모빌리티와 자율주행 로봇 배송 사업 맞손,0
2546,전자 카카오모빌리티와 새로운 모빌리티 기술서비스 발굴 나선다,1
2547,진에어 카카오토스페이와 함께 하는 할인 프로모션 진행,0
2548,카카오 소상공인상생 신설전통시장에 튜터 파견한다,1
2549,상생 공언한 카카오 소상공인 온라인 판매 과외 나선다,0
2550,전자 카카오모빌리티와 로봇배송 협력,1
2551,전자카카오모빌리티 미래차 연구개발 맞손,0
2552,전자 카카오모빌리티와 협력기술서비스 공동개발 나선다,0
2553,특징주 한은 금리인상 시사네이버카카오 약세,1
2554,코스피 상승 출발 카카오 시총 위로 밀려 개장시황,0
2555,카카오모빌리티 팔리면 내 이동정보는,0
2556,카카오 콘텐츠 이어 커머스로 해외진출,0
2557,국민주 카카오 년 만에 시총 톱 밖으로 밀려나,1
2558,네이버 거래일만에 상승카카오도 거래일만에 소폭 반등,1
2559,카카오모빌리티 팔리면 내 이동정보는,0
2560,카카오 콘텐츠 이어 커머스로 해외진출,0
2561,국민주 카카오 년 만에 시총 톱 밖으로 밀려나,1
2562,네이버 거래일만에 상승카카오도 거래일만에 소폭 반등,1
2563,이용자가 인재 추천하면 만원 이 카카오 계열사 어디,0
2564,   카카오 관심사 타고 모든 지구인 연결,1
2565,카카오 노조 카카오모빌리티 매각 반대단체 교섭 응해라,0
2566,카카오노조 카카오모빌리티 매각 반대단체교섭 요구,0
2567,카카오노조 단체행동 예고 모빌리티 사모펀드 매각 철회하라,0
2568,또다시 검은 월요일삼성전자카카오 신저가 마감시황,0
2569,특징주네이버카카오 주 신저가 갈아치워,0
2570,특징주네이버카카오 외인 팔자에 또 신저가 경신,0
2571,년새  급락한 카카오또 빠져 매일 신저가 충격,1
2572,특징주네이버카카오 주 신저가 갈아치워,0
2573,특징주네이버카카오 외인 팔자에 또 신저가 경신,0
2574,년새  급락한 카카오또 빠져 매일 신저가 충격,1
2575,카카오 유니버스 공개한 카카오 주가 전망은 증권플러스 설문 결과 ,0
2576,티맵 대리운전 호출중개 업체 인수대리운전 시장 카카오티맵으로 양분,1
2577,휴양지 가고 금요일 쉬고카카오네이버 직원 월부터 이렇게 일한다,0
2578,물어는 봤어네이버 갓수연  카카오 판옵티콘 민심 왜,0
2579,도쿄서 원격 근무 주 일제네이버카카오 직원들 좋겠네,0
2580,눈물까지 흘린 카카오모빌리티 대표직원 반응은 싸늘 슈,1
2581,카카오모빌리티 매각설 모락모락얽히고설킨 이해관계,0
2582,카카오 직원들은 좋겠네다음 달부터 주 일제 도입,0
2583,카카오 월부터 격주 놀금 제도 테스트,0
2584,카카오 내달부터 새 근무제격주 놀금 도입,0
2585,카카오 격주놀금 또 파격실험들끓은 민심 진화될까,1
2586,카카오 직원들은 좋겠네다음 달부터 주 일제 도입,0
2587,카카오 월부터 격주 놀금 제도 테스트,0
2588,카카오 내달부터 새 근무제격주 놀금 도입,0
2589,카카오 격주놀금 또 파격실험들끓은 민심 진화될까,1
2590,카카오 폐인 됐다 고점 대비 대표가 저점매수 한들,1
2591,카카오 격주 금요일 쉰다내달 일부터 새 근무제,0
2592,단독 매각 반대 카카오모빌리티 직원 노조 가입률  돌파,0
2593,잠재 고객만 만명 카카오가 밝힌 차기 캐시카우는,0
2594,끝없는 내리막카카오네이버 주 신저가,0
2595,대체 바닥이 어디야 곡소리네이버카카오 또 주 신저가,0
2596,특징주 삼전네이버카카오 줄신저가동학개미 눈물,1
2597,특징주네이버카카오 연일 신저가년 주가 수준 회귀,0
2598,특징주 네이버카카오 줄하락주 신저가 경신하나,0
2599,특징주 삼전네이버카카오 줄신저가동학개미 눈물,1
2600,특징주네이버카카오 연일 신저가년 주가 수준 회귀,0
2601,특징주 네이버카카오 줄하락주 신저가 경신하나,0
2602,특징주 카카오 또 신저가,0
2603,매각설 카카오모빌리티류긍선 대표 오늘 임직원 간담회 예정,0
2604,올 들어 속절없이 하락네이버카카오 주가 향방은,0
2605,카카오모빌리티 정말 매각될까 업계 추측 엇갈려,1
2606,단독카카오 지그재그 해외 역직구 본격 진출부터 공략,0
2607,카카오택시서 영화 본다+카카오모빌리티 맞손,0
2608,한화 카카오 목표가 만 만 원,0
2609,카카오 주요 사업부 회복세오픈채팅 광고는 새로운 동력한화,0
2610,카카오 이익 성장 본격화해야 의미있는 주가 상승목표가한화,1
2611,증권 카카오 실적 양호하나 카카오모빌리티 매각 등 변수 발목목,1
2612,클릭 종목카카오 실적은 양호하나 성장주에 부담인 환경목표주,0
2613,카카오 실적 양호하나 외부변수 작용목표가  ,1
2614,카카오 불확실성에도 실적 성장 기대목표가 만원증권,1
2615,매각설에 뒤숭숭한 카카오모빌리티대표는 주주구성 바뀌어도 권리침해 ,0
2616,상장이냐 매각이냐 뒤숭숭한 카카오모빌리티쉽게 팔긴 어려울 듯,0
2617,영상연일 신저가 카카오 시장탓 성장성 의문,0
2618,카카오모빌리티 매각 속사정에 돈 줘야하는데 상장 어려워지자 ,0
2619,카카오모빌리티 매각 카카오 주가는 신저가 나락,0
2620,카카오 카카오모빌리티 매각 결정된 사항 없다,0
2621,카카오 카카오모빌리티 매각설에 여러 방안 검토 중주목 공시,1
2622,카카오 카카오모빌리티 매각 결정된 사항 없어,0
2623,다시 불법 될지도 모르는데소프트뱅크카카오는 왜 비대면의료에 투자,0
2624,네이버카카오 신저가 또 신저가 기록빅테크의 굴욕,1
2625,플랫폼만 하겠다카카오와 보험업 노선 다른 네이버,0
2626,삼성카카오네이버 등 취업 등용문 이곳벌써 명 배출,1
2627,낙원인가 악몽인가 카카오 메타버스 근무가 쏘아 올린 공,0
2628,카카오 자회사 카카오모빌리티 매각 추진,0
2629,카카오 카카오모빌리티 매각 시동,0
2630,카카오 카카오모빌리티 매각 검토사모펀드와 협상 중,1
2631,규제 리스크평판 악화에카카오 알짜 모빌리티 매각 강수,0
2632,몸값 조 카카오모빌리티 파트너스가 인수 추진,0
2633,인앱결제 놓고 구글  카카오 길어지는 힘겨루기 누가 웃을까,0
2634,인앱결제 두고 깊어지는 카카오구글 눈치싸움향후 전망은,0
2635,영상연일 신저가 카카오 시장탓 성장성 의문,0
2636,카카오모빌리티 매각 속사정에 돈 줘야하는데 상장 어려워지자 ,0
2637,카카오모빌리티 매각 카카오 주가는 신저가 나락,0
2638,카카오 카카오모빌리티 매각 결정된 사항 없다,0
2639,카카오 카카오모빌리티 매각설에 여러 방안 검토 중주목 공시,1
2640,카카오 카카오모빌리티 매각 결정된 사항 없어,0
2641,플랫폼만 하겠다카카오와 보험업 노선 다른 네이버,0
2642,삼성카카오네이버 등 취업 등용문 이곳벌써 명 배출,1
2643,낙원인가 악몽인가 카카오 메타버스 근무가 쏘아 올린 공,0
2644,카카오 자회사 카카오모빌리티 매각 추진,0
2645,카카오 카카오모빌리티 매각 시동,0
2646,카카오 카카오모빌리티 매각 검토사모펀드와 협상 중,1
2647,규제 리스크평판 악화에카카오 알짜 모빌리티 매각 강수,0
2648,몸값 조 카카오모빌리티 파트너스가 인수 추진,0
2649,인앱결제 놓고 구글  카카오 길어지는 힘겨루기 누가 웃을까,0
2650,인앱결제 두고 깊어지는 카카오구글 눈치싸움향후 전망은,0
2651,바닥 다지기 끝났나 카카오패밀리 상승 마감 왜,0
2652,선 방어 실패한 코스피삼전네이버카카오 연이틀 신저가,0
2653,카카오 형제 나란히 신저가코스피 년 개월만에 선 붕,1
2654,코스피 급락장서카카오 형제에 공매도 억 투하,0
2655,카카오 카카오모빌리티 매각 시동,0
2656,카카오 카카오모빌리티 매각 검토사모펀드와 협상 중,1
2657,규제 리스크평판 악화에카카오 알짜 모빌리티 매각 강수,0
2658,몸값 조 카카오모빌리티 파트너스가 인수 추진,0
2659,인앱결제 놓고 구글  카카오 길어지는 힘겨루기 누가 웃을까,0
2660,인앱결제 두고 깊어지는 카카오구글 눈치싸움향후 전망은,0
2661,바닥 다지기 끝났나 카카오패밀리 상승 마감 왜,0
2662,선 방어 실패한 코스피삼전네이버카카오 연이틀 신저가,0
2663,카카오 형제 나란히 신저가코스피 년 개월만에 선 붕,1
2664,코스피 급락장서카카오 형제에 공매도 억 투하,0
2665,코스피 덮친 고 불황네이버카카오 뚝 정유금융은 쑥,0
2666,페이 울고 뱅크 웃고엇갈린 카카오 핀테크,1
2667, 인플레 공포에네이버카카오 또 주 신저가,1
2668,특징주 네이버카카오 이틀째 주 신저가 경신,0
2669,특징주네이버카카오 대 하락또 신저가,0
2670,인앱결제 두고 깊어지는 카카오구글 눈치싸움향후 전망은,0
2671,페이 울고 뱅크 웃고엇갈린 카카오 핀테크,1
2672, 인플레 공포에네이버카카오 또 주 신저가,1
2673,특징주 네이버카카오 이틀째 주 신저가 경신,0
2674,특징주네이버카카오 대 하락또 신저가,0
2675,흔들리는 성장주네이버카카오 또 주 신저가,1
2676,해외여행 전과정 원스톱 처리 카카오  항공 국제선 서비스,0
2677,이제 카카오 로 국제선 비행기표도 예약,0
2678,하늘길 노리는 카카오카카오 항공 국제선 서비스 오픈,0
2679,처음 보는데 이렇게 잘나가 카카오 억원 쏟은 이 분,0
2680,울고싶은데 뺨맞은 카카오형제 시총 조원 증발,0
2681,카카오뱅크에도  자본이 카카오에 드리워진 차이나리스크,0
2682,카카오 앱으로 국제선 항공권도 예매한다,0
